{
  "eventId": "8dbfe0a7-3b28-4109-8fcb-9fbc9c37d56a",
  "eventTarget": "client-topic",
  "eventTime": "2022-05-09T13:34:50.466+0000",
  "event": {
    "response-data": {
      "ietf-netconf-monitoring:netconf-state": {
        "schemas": {
          "schema": [
            {
              "identifier": "ietf-tls-server",
              "version": "2016-11-02",
              "format": "ietf-netconf-monitoring:yang",
              "namespace": "urn:ietf:params:xml:ns:yang:ietf-tls-server",
              "location": [
                "NETCONF"
              ]
            }
          ]
        }
      }
    }
  }
}
